<!--
	http://www.pavillon-noir.org/
	XML DTD for 3D models and scripts (entities.xml)
-->

<!-- HEADER -->

<!ENTITY % object.dtd SYSTEM "../objects/object.dtd">

<!-- ELEMENTS -->

<!ELEMENT entities (entity*, skybox?)>
<!ELEMENT skybox (object?)>
<!ELEMENT entity (script?, object?)>
    <!ELEMENT script (init_code, action_code)>
        <!ELEMENT init_code (#PCDATA)>
        <!ELEMENT action_code (#PCDATA)>

<!-- ENTITIES ATTRIBUTES -->

<!ATTLIST entities mpp CDATA #IMPLIED>

<!-- ENTITY ATTRIBUTES -->

<!ATTLIST entity id ID #REQUIRED>
<!ATTLIST entity label CDATA #IMPLIED>
<!ATTLIST entity mdref CDATA #REQUIRED>
<!ATTLIST entity class CDATA #REQUIRED>
<!ATTLIST entity envtype (dynamic|static|ground) "dynamic">
<!ATTLIST entity objtype (object|dynamic|character) "object">
<!ATTLIST entity x CDATA #REQUIRED>
<!ATTLIST entity y CDATA #REQUIRED>
<!ATTLIST entity z CDATA #REQUIRED>
<!ATTLIST entity xx CDATA #REQUIRED>
<!ATTLIST entity yy CDATA #REQUIRED>
<!ATTLIST entity zz CDATA #REQUIRED>
<!ATTLIST entity ww CDATA #REQUIRED>

<!ATTLIST skybox enabled (true|false) #IMPLIED>
<!ATTLIST skybox top CDATA #IMPLIED>
<!ATTLIST skybox botttom CDATA #IMPLIED>
<!ATTLIST skybox left CDATA #IMPLIED>
<!ATTLIST skybox right CDATA #IMPLIED>
<!ATTLIST skybox front CDATA #IMPLIED>
<!ATTLIST skybox back CDATA #IMPLIED>

<!ATTLIST script type CDATA #IMPLIED>

<!ATTLIST init_code src CDATA #IMPLIED>
<!ATTLIST action_code src CDATA #IMPLIED>


<!-- EXTERNALS -->

%object.dtd;