<?xml version="1.0"?>
<!DOCTYPE entities SYSTEM "../entities.dtd">
<entities>
<!-- entity id="0" label="Ground" mdref="JiveImportPlan.pno" envtype="static" objtype="object" class="PN3DObject" x="0" y="0" z="0" xx="0" yy="0" zz="-0.008725" ww="0.999809">
</entity -->
<entity id="0" label="Ground" mdref="JiveImportPlan.pno" envtype="static" objtype="object" class="PN3DObject" x="0" y="0" z="0" xx="0" yy="0" zz="0" ww="1">
</entity>
<entity id="1" label="CollideBox" mdref="JiveImportBox_02.pno" envtype="dynamic" objtype="object" class="PN3DObject" x="0" y="500" z="0" xx="0" yy="0" zz="0" ww="1">
</entity>
<entity id="2" label="CollideBox" mdref="JiveImportBox_02.pno" envtype="dynamic" objtype="object" class="PN3DObject" x="0" y="1000" z="100" xx="0" yy="0" zz="0" ww="1">
</entity>
<entity id="3" label="CollidePave" mdref="JiveImportPave.pno" envtype="dynamic" objtype="object" class="PN3DObject" x="0" y="800" z="100" xx="0" yy="0" zz="0" ww="1">
</entity>
<entity id="4" label="CollideSphere" mdref="JiveImportSphere.pno" envtype="dynamic" objtype="object" class="PN3DObject" x="0" y="500" z="300" xx="0" yy="0" zz="0" ww="1">
</entity>
<entity id="5" label="CollideSphere" mdref="JiveImportSphere.pno" envtype="dynamic" objtype="object" class="PN3DObject" x="45" y="650" z="300" xx="0" yy="0" zz="0" ww="1">
</entity>
<entity id="6" label="CollideSphere" mdref="JiveImportSphere.pno" envtype="dynamic" objtype="object" class="PN3DObject" x="100" y="600" z="30" xx="0" yy="0" zz="0" ww="1">
</entity>
<entity id="Player" label="pirate1" mdref="[non-free]pirate.pno" envtype="dynamic" objtype="object" class="PNPlayer" x="-349.293274" y="60.0" z="-161.569168" xx="0.000000" yy="0.000000" zz="0.000000" ww="1.000000">
</entity>
</entities>
