<?xml version="1.0"?>
<!DOCTYPE entities SYSTEM "../entities.dtd">
<entities mpp="0.5">
<entity id="id_0" label="Ground" mdref="JiveImportPlan.pno" envtype="static" objtype="object" class="PN3DObject" x="0" y="0" z="0" xx="0" yy="0" zz="0" ww="1">
</entity>
<entity id="id_1" label="CollideBox" mdref="JiveImportBox_02.pno" envtype="dynamic" objtype="object" class="PN3DObject" x="0" y="500" z="0" xx="0" yy="0" zz="0" ww="1">
</entity>
<entity id="id_2" label="CollideBox" mdref="JiveImportBox_02.pno" envtype="dynamic" objtype="object" class="PN3DObject" x="0" y="1000" z="100" xx="0" yy="0" zz="0" ww="1">
</entity>
<entity id="id_3" label="CollidePave" mdref="JiveImportPave.pno" envtype="dynamic" objtype="object" class="PN3DObject" x="0" y="800" z="100" xx="0" yy="0" zz="0" ww="1">
</entity>
<entity id="id_4" label="CollideSphere" mdref="JiveImportSphere.pno" envtype="dynamic" objtype="object" class="PN3DObject" x="0" y="500" z="300" xx="0" yy="0" zz="0" ww="1">
</entity>
<entity id="id_5" label="CollideSphere" mdref="JiveImportSphere.pno" envtype="dynamic" objtype="object" class="PN3DObject" x="45" y="650" z="300" xx="0" yy="0" zz="0" ww="1">
</entity>
<entity id="id_6" label="CollideSphere" mdref="JiveImportSphere.pno" envtype="dynamic" objtype="object" class="PN3DObject" x="100" y="600" z="30" xx="0" yy="0" zz="0" ww="1">
</entity>
</entities>
